{
  "agent_task_id": "at-mock-001",
  "agent_id": "agent.supply-risk.analyze",
  "resource_plan_id": "plan-mock-001",
  "tenant_ref": "tenant-a",
  "delegation_ref": "delegation:mock-001",
  "delegation_scope": ["analysis.read", "report.write"],
  "requested_scopes": ["analysis.read"],
  "granted_scopes": ["analysis.read"],
  "state": "COMPLETED",
  "artifact_ref": {
    "uri": "evidence://agent-tasks/at-mock-001/artifact",
    "digest": "sha256:0000000000000000000000000000000000000000000000000000000000000000"
  },
  "submitted_at": "2026-09-26T00:00:00Z",
  "finished_at": "2026-09-26T00:00:05Z",
  "trace_id": "00-00000000000000000000000000000000-0000000000000000-01"
}
